{
  "v": 1,
  "job_id": "01929b10-4c2d-7e00-9a00-0000000000f1",
  "version": "1.5.0",
  "url": "https://fw.eu.lumio.io/acme/P2/1.5.0.bin?Expires=1761213600&Signature=example",
  "size": 1048576,
  "sha256": "d53dde0d595ea480e1fc8a5d8ed9f93205dc0d6d7d3beaefd91bdb9ffc80eda6",
  "manifest": {
    "hw_type": "01928f3e-5a7b-7c00-8d00-0000000000a1",
    "model_code": "P2",
    "version": "1.5.0",
    "min_from_version": "1.2.0",
    "size": 1048576,
    "sha256": "d53dde0d595ea480e1fc8a5d8ed9f93205dc0d6d7d3beaefd91bdb9ffc80eda6",
    "mandatory": false,
    "created_at": "2026-10-20T09:00:00Z"
  },
  "manifest_sig": "GUVCJOVaecWi+hmPfZ7DpF1VSrRSeGtN95IwjbCkK8kFXoX9Np1tGo1J1ndaQC9hsJopyfC9fHJFpTl0twYgDg==",
  "install_after": 1761271200000,
  "mandatory": false
}
